{
  "catalog_version": "1.0.0",
  "catalog_sha256": "c51e07b98c6c380545685ae0585644fcb8eb5a5b5a2e2fee936f2e0dca15bc8f",
  "source": {
    "dataset_id": "MIMIC-IV-Ext-Apixaban-Trial-Criteria-Questions",
    "dataset_version": "1.0.0",
    "source_csv_sha256": "8e8083b0b5e3d038ad912a812be1bb8a53f8a59bc37a4c29d8a420cb4296e267"
  },
  "semantics": {
    "prediction_target": "note_grounded_fact_assessment",
    "eligibility_mapping": "separate_criterion_specific_step",
    "boolean_normalization": "Yes=present/true; No=absent/false",
    "absent_meaning": "question_protocol_no_not_confirmed_clinical_absence",
    "numeric_normalization": "finite source number=present",
    "unknown_normalization": "not_specified or source_anomaly=unknown/null",
    "unit_policy": "not_defined_by_source_questions"
  },
  "questions": [
    {
      "question_id": "apixaban-q-d38bd8616c9952dc",
      "source_criterion_label": "afib",
      "fact_field": "atrial_fibrillation",
      "question_type": "boolean",
      "source_question": "Does the note describe the patient as having permanent, paroxysmal, or persistent afib?",
      "aggregation": "question_defined_boolean",
      "value_type": "boolean",
      "canonical_unit": null,
      "unit_policy": "not_defined_by_source_question",
      "allowed_fact_status": ["present", "absent", "unknown"],
      "eligibility_interpretation": "fact_only_no_direct_mapping"
    },
    {
      "question_id": "apixaban-q-e6783d58af7c09d2",
      "source_criterion_label": "chads2",
      "fact_field": "chads2_score",
      "question_type": "numeric",
      "source_question": "What is the highest CHADS2 score mentioned? Answer \"NA\" if no CHADS2 score is in the note. ",
      "aggregation": "maximum",
      "value_type": "number",
      "canonical_unit": null,
      "unit_policy": "not_defined_by_source_question",
      "allowed_fact_status": ["present", "unknown"],
      "eligibility_interpretation": "fact_only_no_direct_mapping"
    },
    {
      "question_id": "apixaban-q-88f4014e56a703e5",
      "source_criterion_label": "prior_stroke",
      "fact_field": "prior_stroke_or_tia",
      "question_type": "boolean",
      "source_question": "Does the note describe the patient as ever having a stroke or transient ischemic attack?",
      "aggregation": "question_defined_boolean",
      "value_type": "boolean",
      "canonical_unit": null,
      "unit_policy": "not_defined_by_source_question",
      "allowed_fact_status": ["present", "absent", "unknown"],
      "eligibility_interpretation": "fact_only_no_direct_mapping"
    },
    {
      "question_id": "apixaban-q-0bab13ea4eeebefc",
      "source_criterion_label": "arterial_hypertension",
      "fact_field": "treated_arterial_hypertension",
      "question_type": "boolean",
      "source_question": "Does the note describe the patient as having arterial hypertension on treatment (high bp e.g. >140, or HTN)?",
      "aggregation": "question_defined_boolean",
      "value_type": "boolean",
      "canonical_unit": null,
      "unit_policy": "not_defined_by_source_question",
      "allowed_fact_status": ["present", "absent", "unknown"],
      "eligibility_interpretation": "fact_only_no_direct_mapping"
    },
    {
      "question_id": "apixaban-q-8d9ec5c5c22d1ef1",
      "source_criterion_label": "t2d",
      "fact_field": "diabetes_mellitus",
      "question_type": "boolean",
      "source_question": "Does the note describe the patient as having Diabetes mellitus (DM1, DM2, T2D, T1DM, T2DM)?",
      "aggregation": "question_defined_boolean",
      "value_type": "boolean",
      "canonical_unit": null,
      "unit_policy": "not_defined_by_source_question",
      "allowed_fact_status": ["present", "absent", "unknown"],
      "eligibility_interpretation": "fact_only_no_direct_mapping"
    },
    {
      "question_id": "apixaban-q-4547e40560979dc8",
      "source_criterion_label": "blood_glucose",
      "fact_field": "blood_glucose",
      "question_type": "numeric",
      "source_question": "What is the highest blood glucose lab mentioned? Answer \"NA\" if no blood glucose score is in the note.",
      "aggregation": "maximum",
      "value_type": "number",
      "canonical_unit": null,
      "unit_policy": "not_defined_by_source_question",
      "allowed_fact_status": ["present", "unknown"],
      "eligibility_interpretation": "fact_only_no_direct_mapping"
    },
    {
      "question_id": "apixaban-q-313364458229b1b1",
      "source_criterion_label": "heart_failure",
      "fact_field": "heart_failure",
      "question_type": "boolean",
      "source_question": "Does the note describe the patient as having heart failure?",
      "aggregation": "question_defined_boolean",
      "value_type": "boolean",
      "canonical_unit": null,
      "unit_policy": "not_defined_by_source_question",
      "allowed_fact_status": ["present", "absent", "unknown"],
      "eligibility_interpretation": "fact_only_no_direct_mapping"
    },
    {
      "question_id": "apixaban-q-dc8ad785ff98b239",
      "source_criterion_label": "lvef",
      "fact_field": "left_ventricular_ejection_fraction",
      "question_type": "numeric",
      "source_question": "What is the lowest left ventricular ejection (LVEF, ef, ejection fraction) fraction mentioned in the note? Answer \"NA\" if no LVEF is in the note, Answer 55 if the lowest value is 55% or greater.",
      "aggregation": "minimum",
      "value_type": "number",
      "canonical_unit": null,
      "unit_policy": "not_defined_by_source_question",
      "allowed_fact_status": ["present", "unknown"],
      "eligibility_interpretation": "fact_only_no_direct_mapping"
    },
    {
      "question_id": "apixaban-q-60e6d5ed5e9d9dfd",
      "source_criterion_label": "surgical_valvular_disease",
      "fact_field": "valvular_disease_requiring_surgery",
      "question_type": "boolean",
      "source_question": "Does the note describe the patient as ever having valvular disease requiring surgery (stenosis)?",
      "aggregation": "question_defined_boolean",
      "value_type": "boolean",
      "canonical_unit": null,
      "unit_policy": "not_defined_by_source_question",
      "allowed_fact_status": ["present", "absent", "unknown"],
      "eligibility_interpretation": "fact_only_no_direct_mapping"
    },
    {
      "question_id": "apixaban-q-733abbc27989dac4",
      "source_criterion_label": "afib_ablation",
      "fact_field": "afib_ablation",
      "question_type": "boolean",
      "source_question": "Does the note describe the patient as having a planned or past ablation procedure for afib?",
      "aggregation": "question_defined_boolean",
      "value_type": "boolean",
      "canonical_unit": null,
      "unit_policy": "not_defined_by_source_question",
      "allowed_fact_status": ["present", "absent", "unknown"],
      "eligibility_interpretation": "fact_only_no_direct_mapping"
    },
    {
      "question_id": "apixaban-q-d01a22804f1dbebf",
      "source_criterion_label": "bleeding",
      "fact_field": "serious_bleeding_within_6_months",
      "question_type": "boolean",
      "source_question": "Does the note describe the patient as having a serious bleeding in the past 6 months?",
      "aggregation": "question_defined_boolean",
      "value_type": "boolean",
      "canonical_unit": null,
      "unit_policy": "not_defined_by_source_question",
      "allowed_fact_status": ["present", "absent", "unknown"],
      "eligibility_interpretation": "fact_only_no_direct_mapping"
    },
    {
      "question_id": "apixaban-q-efd93b9e57394cd9",
      "source_criterion_label": "peptic_ulcer_disease",
      "fact_field": "peptic_ulcer_disease",
      "question_type": "boolean",
      "source_question": "Does the note describe the patient as ever having peptic ulcer disease?",
      "aggregation": "question_defined_boolean",
      "value_type": "boolean",
      "canonical_unit": null,
      "unit_policy": "not_defined_by_source_question",
      "allowed_fact_status": ["present", "absent", "unknown"],
      "eligibility_interpretation": "fact_only_no_direct_mapping"
    },
    {
      "question_id": "apixaban-q-0254f569c4046777",
      "source_criterion_label": "PLT",
      "fact_field": "platelet_count",
      "question_type": "numeric",
      "source_question": "What is the lowest platelet count (PLT) mentioned in the note? Answer \"NA\" if no platelet count is available in the note.",
      "aggregation": "minimum",
      "value_type": "number",
      "canonical_unit": null,
      "unit_policy": "not_defined_by_source_question",
      "allowed_fact_status": ["present", "unknown"],
      "eligibility_interpretation": "fact_only_no_direct_mapping"
    },
    {
      "question_id": "apixaban-q-a69f4c14589e7f29",
      "source_criterion_label": "HGB",
      "fact_field": "hemoglobin",
      "question_type": "numeric",
      "source_question": "What is the lowest hemoglobin (HGB) mentioned in the note? Answer \"NA\" if no HGB value is available in the note.",
      "aggregation": "minimum",
      "value_type": "number",
      "canonical_unit": null,
      "unit_policy": "not_defined_by_source_question",
      "allowed_fact_status": ["present", "unknown"],
      "eligibility_interpretation": "fact_only_no_direct_mapping"
    },
    {
      "question_id": "apixaban-q-4d6ca39c1adc01f8",
      "source_criterion_label": "recent_stroke",
      "fact_field": "stroke_during_admission_or_within_last_month",
      "question_type": "boolean",
      "source_question": "Does the note describe the patient as having a stroke during this admission or within the last month? (Answer yes for any recent stroke if the date is unclear)",
      "aggregation": "question_defined_boolean",
      "value_type": "boolean",
      "canonical_unit": null,
      "unit_policy": "not_defined_by_source_question",
      "allowed_fact_status": ["present", "absent", "unknown"],
      "eligibility_interpretation": "fact_only_no_direct_mapping"
    },
    {